{
  "trustRootId": "RCV-CLAIM-LEGAL-PUBLIC-KEY-TRUST-ROOT",
  "trustRootVersion": 1,
  "status": "ACTIVE",
  "runtimeStatus": "DORMANT",
  "signingAuthorityStatus": "NOT_ACTIVE",
  "productionSignatureStatus": "NONE",
  "provider": "AWS_KMS",
  "environment": "production",
  "createdAt": "2026-07-29T19:39:13Z",
  "activatedAt": "2026-07-29T19:39:13Z",
  "entries": [
    {
      "algorithm": "Ed25519",
      "allowedDocumentTypes": ["LEGAL_BASIS_RELEASE"],
      "allowedSignaturePurposes": ["LEGAL_REVIEW_APPROVAL"],
      "authorityEvidenceRef": "decision-log:RCV-CLAIM-FORM-P02-S08-D02-F01-R03#LEGAL_REVIEWER",
      "awsEvidenceHash": "f6c6f308dc2a1f4c07f179c0523a5f98804f5cf00dcb97d0abd49305d2be5eb8",
      "compromisePolicyId": "RCV-CLAIM-LEGAL-SIGNER-COMPROMISE-RESPONSE@1",
      "createdAt": "2026-07-29T06:50:51Z",
      "custodyOwner": "Av. Fatma Uluca Telli",
      "displayName": "Av. Fatma Uluca Telli",
      "fingerprint": "f5ea7e0a4df63e7b64faf7ad0b590e3cfb7af312d0050bf62da48b07635bc66a",
      "fingerprintAlgorithm": "SHA-256",
      "forbiddenSignaturePurposes": [
        "FINAL_LEGAL_RATIFICATION",
        "PRODUCTION_RELEASE"
      ],
      "keyId": "rcv-lb-ed25519-f5ea7e0a4df63e7b64faf7ad0b590e3cfb7af312d0050bf62da48b07635bc66a",
      "keyUsage": "SIGN_VERIFY",
      "kc01ManifestChecksum": "1e80168ebc52e6601f9231834ddde81a339e69a2337a0630bd9daa993f0519ec",
      "kc01ManifestVersion": 1,
      "provider": "AWS_KMS",
      "providerAlias": "alias/telli-legal-reviewer-01",
      "providerPublicKey": "MCowBQYDK2VwAyEA4p1lyqpSkyQ5kFjKgqeq3xA9MTCkEQmHOzamYS4CHMg=",
      "providerPublicKeyEncoding": "BASE64",
      "providerPublicKeyFingerprint": "bb35e308e429124c5cd2865930d926de5cd43a7caf2cc4e690505bbe228b0f34",
      "providerPublicKeyFingerprintAlgorithm": "SHA-256",
      "providerPublicKeyFormat": "SPKI_DER",
      "publicKey": "4p1lyqpSkyQ5kFjKgqeq3xA9MTCkEQmHOzamYS4CHMg",
      "publicKeyEncoding": "BASE64URL_UNPADDED",
      "publicKeyFormat": "RAW_32",
      "region": "eu-central-1",
      "revocationPolicyId": "RCV-CLAIM-LEGAL-SIGNER-REVOCATION-POLICY@1",
      "revocationReason": null,
      "revokedAt": null,
      "role": "LEGAL_REVIEWER",
      "rotationPolicyId": "RCV-CLAIM-LEGAL-SIGNER-ROTATION-POLICY@1",
      "signerId": "TELLI-LEGAL-REVIEWER-01",
      "signingAlgorithm": "ED25519_SHA_512",
      "signingAuthorityStatus": "NOT_ACTIVE",
      "status": "ACTIVE_FOR_VERIFICATION",
      "subjectType": "HUMAN",
      "supersedesSignerKey": null,
      "validFrom": "2026-07-29T19:39:13Z",
      "validUntil": null
    },
    {
      "algorithm": "Ed25519",
      "allowedDocumentTypes": ["LEGAL_BASIS_RELEASE"],
      "allowedSignaturePurposes": ["FINAL_LEGAL_RATIFICATION"],
      "authorityEvidenceRef": "decision-log:RCV-CLAIM-FORM-P02-S08-D02-F01-R03#FINAL_LEGAL_RATIFIER",
      "awsEvidenceHash": "67a2b90f00f3f34b8e31a6fad698045f7334e1e6320aeac1096f4d41bf7f22e2",
      "compromisePolicyId": "RCV-CLAIM-LEGAL-SIGNER-COMPROMISE-RESPONSE@1",
      "createdAt": "2026-07-29T06:52:41Z",
      "custodyOwner": "Av. Ulaş Hüseyin Telli",
      "displayName": "Av. Ulaş Hüseyin Telli",
      "fingerprint": "5d798d43de4cf8dde7c39583d5a09aae2110d1ac443495f6b32f39920add26d2",
      "fingerprintAlgorithm": "SHA-256",
      "forbiddenSignaturePurposes": [
        "LEGAL_REVIEW_APPROVAL",
        "PRODUCTION_RELEASE"
      ],
      "keyId": "rcv-lb-ed25519-5d798d43de4cf8dde7c39583d5a09aae2110d1ac443495f6b32f39920add26d2",
      "keyUsage": "SIGN_VERIFY",
      "kc01ManifestChecksum": "1e80168ebc52e6601f9231834ddde81a339e69a2337a0630bd9daa993f0519ec",
      "kc01ManifestVersion": 1,
      "provider": "AWS_KMS",
      "providerAlias": "alias/telli-final-legal-ratifier-01",
      "providerPublicKey": "MCowBQYDK2VwAyEAmW71eurfgCUya/BeSRxTs66Yj4MekXC/0v8wMT3J1v4=",
      "providerPublicKeyEncoding": "BASE64",
      "providerPublicKeyFingerprint": "1da0f683f9922cb564544e5d31633aacb5c3bbdc53b15f6c6c96cb6925a61e40",
      "providerPublicKeyFingerprintAlgorithm": "SHA-256",
      "providerPublicKeyFormat": "SPKI_DER",
      "publicKey": "mW71eurfgCUya_BeSRxTs66Yj4MekXC_0v8wMT3J1v4",
      "publicKeyEncoding": "BASE64URL_UNPADDED",
      "publicKeyFormat": "RAW_32",
      "region": "eu-central-1",
      "revocationPolicyId": "RCV-CLAIM-LEGAL-SIGNER-REVOCATION-POLICY@1",
      "revocationReason": null,
      "revokedAt": null,
      "role": "FINAL_LEGAL_RATIFIER",
      "rotationPolicyId": "RCV-CLAIM-LEGAL-SIGNER-ROTATION-POLICY@1",
      "signerId": "TELLI-FINAL-LEGAL-RATIFIER-01",
      "signingAlgorithm": "ED25519_SHA_512",
      "signingAuthorityStatus": "NOT_ACTIVE",
      "status": "ACTIVE_FOR_VERIFICATION",
      "subjectType": "HUMAN",
      "supersedesSignerKey": null,
      "validFrom": "2026-07-29T19:39:13Z",
      "validUntil": null
    },
    {
      "algorithm": "Ed25519",
      "allowedDocumentTypes": ["LEGAL_BASIS_RELEASE"],
      "allowedSignaturePurposes": ["PRODUCTION_RELEASE"],
      "authorityEvidenceRef": "decision-log:RCV-CLAIM-FORM-P02-S08-D02-F01-R03#PRODUCTION_RELEASE_SIGNER",
      "awsEvidenceHash": "aa6f4f49e9ca7e046ebd5ca66c175f0f425ab4d514a84edf188e2f0651a64771",
      "compromisePolicyId": "RCV-CLAIM-LEGAL-SIGNER-COMPROMISE-RESPONSE@1",
      "createdAt": "2026-07-29T06:52:46Z",
      "custodyOwner": "Telli-Hukuk",
      "displayName": "Telli Legal Release Service",
      "fingerprint": "00067ce0d6cc2091532cb9f0631ca716462f0c8fdf7d8c15c82635aebf6bb16f",
      "fingerprintAlgorithm": "SHA-256",
      "forbiddenSignaturePurposes": [
        "LEGAL_REVIEW_APPROVAL",
        "FINAL_LEGAL_RATIFICATION"
      ],
      "keyId": "rcv-lb-ed25519-00067ce0d6cc2091532cb9f0631ca716462f0c8fdf7d8c15c82635aebf6bb16f",
      "keyUsage": "SIGN_VERIFY",
      "kc01ManifestChecksum": "1e80168ebc52e6601f9231834ddde81a339e69a2337a0630bd9daa993f0519ec",
      "kc01ManifestVersion": 1,
      "provider": "AWS_KMS",
      "providerAlias": "alias/telli-prod-legal-01",
      "providerPublicKey": "MCowBQYDK2VwAyEA626BJiW9j466gX6u0Pw62WB+S+OF6LPU1qJawCfJIJU=",
      "providerPublicKeyEncoding": "BASE64",
      "providerPublicKeyFingerprint": "88cd9f1bdb50f57bc6a7496f9b94136bfbf4658888b5d82f933f3b5fb0537314",
      "providerPublicKeyFingerprintAlgorithm": "SHA-256",
      "providerPublicKeyFormat": "SPKI_DER",
      "publicKey": "626BJiW9j466gX6u0Pw62WB-S-OF6LPU1qJawCfJIJU",
      "publicKeyEncoding": "BASE64URL_UNPADDED",
      "publicKeyFormat": "RAW_32",
      "region": "eu-central-1",
      "revocationPolicyId": "RCV-CLAIM-LEGAL-SIGNER-REVOCATION-POLICY@1",
      "revocationReason": null,
      "revokedAt": null,
      "role": "PRODUCTION_RELEASE_SIGNER",
      "rotationPolicyId": "RCV-CLAIM-LEGAL-SIGNER-ROTATION-POLICY@1",
      "signerId": "TELLI-PROD-LEGAL-01",
      "signingAlgorithm": "ED25519_SHA_512",
      "signingAuthorityStatus": "NOT_ACTIVE",
      "status": "ACTIVE_FOR_VERIFICATION",
      "subjectType": "SERVICE",
      "supersedesSignerKey": null,
      "validFrom": "2026-07-29T19:39:13Z",
      "validUntil": null
    }
  ],
  "serializationAlgorithm": "CANONICAL_JSON_UTF8_V1",
  "checksumAlgorithm": "SHA-256",
  "kc01ManifestId": "RCV-CLAIM-LEGAL-SIGNER-PUBLIC-KEY-MANIFEST",
  "kc01ManifestVersion": 1,
  "kc01ManifestChecksum": "1e80168ebc52e6601f9231834ddde81a339e69a2337a0630bd9daa993f0519ec",
  "awsParityRecordId": "RCV-CLAIM-LEGAL-PUBLIC-KEY-TRUST-ROOT-AWS-PARITY@1",
  "awsParityRecordChecksum": "cc10ada801c174442158d0b746b018347d615609b823141ac928b9c44badef13",
  "trustRootChecksum": "062056266b90107780f2f749eba3b55a994738503f354c273ac83e25fdddd247"
}
